{
  "$schema": "https://json-schema.org/draft/2020-12/schema",
  "$id": "urn:ccd:pnp:aspx-platform-registry-profile:spo-online-16.0.27711.12757:r1",
  "title": "Externally pinned ASPX platform registry compatibility profile",
  "type": "object",
  "additionalProperties": false,
  "required": [
    "$schema",
    "profileSchemaVersion",
    "profileRevision",
    "profileHash",
    "registrySchemaVersion",
    "registrySchemaHash",
    "registryRevision",
    "registryHash",
    "authoritySchemaVersion",
    "authorityKind",
    "authoritySourceRef",
    "authoritySourceTag",
    "authorityArtifactHash",
    "platformFamily",
    "platformBuild",
    "consumerProductId",
    "consumerSourceRef",
    "consumerProductRef",
    "contractReviewRef",
    "compatibilityDecisionRef",
    "consumerCompatibilityHash",
    "recordKind",
    "sourceKinds",
    "dispositions",
    "volumeCompatibility",
    "artifactVerification",
    "failureSemantics"
  ],
  "properties": {
    "$schema": { "const": "../schema/aspx-platform-registry-profile.schema.json" },
    "profileSchemaVersion": { "const": "aspx-platform-registry-profile/v2" },
    "profileRevision": { "const": "spo-online-16.0.27711.12757-profile-r1" },
    "profileHash": { "const": "c4a4892fa269484f0badd4fa24364161e8cd9cb0b8bdeac3eebd7b49fb51f51e" },
    "registrySchemaVersion": { "const": "aspx-platform-registry/v1" },
    "registrySchemaHash": { "const": "3ca69e123d826c4273c86b460a33f6d391455449c745e8b9b2455d7db0c9f4e9" },
    "registryRevision": { "const": "spo-online-16.0.27711.12757-r1" },
    "registryHash": { "const": "342b8ed81dfba8404ef70d7c3f876e950f641e861b0d0eab8f30b9cdbfdba5a2" },
    "authoritySchemaVersion": { "const": "aspx-platform-authority/v1" },
    "authorityKind": { "const": "SPOCoreReleaseShippingManifest" },
    "authoritySourceRef": { "const": "0ff1276087a43640144d8072fa347a886473855f" },
    "authoritySourceTag": { "const": "release/16.0.27711.12757" },
    "authorityArtifactHash": { "const": "8394ef9d5f1e6409131835ab123a5104afa5cedc17b65580831ebc7eee81e9d5" },
    "platformFamily": { "const": "SharePointOnline-16" },
    "platformBuild": { "const": "16.0.27711.12757" },
    "consumerProductId": { "const": "pnp/assessment" },
    "consumerSourceRef": { "const": "3012555317d5a8ee981b9e103206f3f0680333d8" },
    "consumerProductRef": { "const": "pnp/assessment@3012555317d5a8ee981b9e103206f3f0680333d8" },
    "contractReviewRef": {
      "const": "CCD-394#document-aspx-surface-applicability-denominator-v3@7d44f61d-919e-478a-ab8e-bb4c8f9b4b4a"
    },
    "compatibilityDecisionRef": { "const": "CCD-411:approve_with_changes" },
    "consumerCompatibilityHash": { "const": "7a38a2b1e643637d2e6a8e34d41e3784416238519bc99e526d74ac4b65435e7a" },
    "recordKind": { "const": "AspxReferenceObservation" },
    "sourceKinds": { "$ref": "#/$defs/sourceKinds" },
    "dispositions": { "$ref": "#/$defs/dispositions" },
    "volumeCompatibility": { "$ref": "#/$defs/volumeCompatibility" },
    "artifactVerification": { "$ref": "#/$defs/artifactVerification" },
    "failureSemantics": { "$ref": "#/$defs/failureSemantics" }
  },
  "$defs": {
    "sha256": { "type": "string", "pattern": "^[0-9a-f]{64}$" },
    "sourceKinds": {
      "type": "array",
      "minItems": 5,
      "maxItems": 5,
      "prefixItems": [
        { "const": "ListFormReference" },
        { "const": "ListViewReference" },
        { "const": "WebWelcomePageReference" },
        { "const": "PlatformRegistryReference" },
        { "const": "RuntimeRequestReference" }
      ],
      "items": false
    },
    "dispositions": {
      "type": "array",
      "minItems": 7,
      "maxItems": 7,
      "prefixItems": [
        { "const": "ReferenceOnlyAvailable" },
        { "const": "ReferenceUnavailable" },
        { "const": "LinkedPhysicalGhosted" },
        { "const": "LinkedPhysicalCustomized" },
        { "const": "VirtualHandler" },
        { "const": "NonAspx" },
        { "const": "Unknown" }
      ],
      "items": false
    },
    "volumeCompatibility": {
      "type": "object",
      "additionalProperties": false,
      "required": [
        "physicalOutput",
        "physicalContract",
        "physicalStore",
        "referenceOutput",
        "referenceContract",
        "referenceStore",
        "aggregateOutput"
      ],
      "properties": {
        "physicalOutput": { "const": "aspx-discovery-output/v2" },
        "physicalContract": { "const": "aspx-discovery/v2" },
        "physicalStore": { "const": "aspx-discovery-sqlite/v2" },
        "referenceOutput": { "const": "aspx-reference-output/v1" },
        "referenceContract": { "const": "aspx-reference/v1" },
        "referenceStore": { "const": "aspx-reference-sqlite/v1" },
        "aggregateOutput": { "const": "aspx-acquisition-verdict/v1" }
      }
    },
    "artifactVerification": {
      "type": "object",
      "additionalProperties": false,
      "required": [
        "actualOutputBytes",
        "actualOutputLength",
        "jsonOutputVersion",
        "jsonTypedContent",
        "acquisitionRunId",
        "sqliteIntegrityCheck",
        "sqliteSchemaManifestAlgorithm",
        "physicalStoreSchemaHash",
        "referenceStoreSchemaHash",
        "sqliteTypedRows",
        "sqliteRunManifestHash",
        "outputStoreManifestBinding"
      ],
      "properties": {
        "actualOutputBytes": { "const": "Required" },
        "actualOutputLength": { "const": "Required" },
        "jsonOutputVersion": { "const": "Exact" },
        "jsonTypedContent": { "const": "ExactVersionedConformance" },
        "acquisitionRunId": { "const": "Exact" },
        "sqliteIntegrityCheck": { "const": "Required" },
        "sqliteSchemaManifestAlgorithm": { "const": "sqlite-schema-manifest/v2" },
        "physicalStoreSchemaHash": { "const": "899aa84b3c1786e1e4754d23b943b4609d23dd4b19d34819c1b7e80ea1f4e504" },
        "referenceStoreSchemaHash": { "const": "73eabd7a2001f7dbaaafa48db4f0c6489b57305a630b53aa2194d1c8cb9af5ec" },
        "sqliteTypedRows": { "const": "ExactVersionedConformance" },
        "sqliteRunManifestHash": { "const": "Required" },
        "outputStoreManifestBinding": { "const": "Required" }
      }
    },
    "failureSemantics": {
      "type": "object",
      "additionalProperties": false,
      "required": [
        "unknownBuild",
        "missingRegistryVolume",
        "registryProfileMismatch",
        "sameRevisionChangedHash",
        "aliasCollision",
        "runtimePathAbsent",
        "unknownSourceKindOrDisposition",
        "missingAcquisitionEnvelope",
        "missingPhysicalVolume",
        "missingReferenceVolume",
        "unsupportedOutputVersion",
        "unsupportedContractVersion",
        "unsupportedStoreVersion",
        "missingArtifactEvidence",
        "volumeHashMismatch",
        "volumeLengthMismatch",
        "volumeContentMismatch",
        "storeIntegrityFailure",
        "storeSchemaMismatch",
        "storeRowContentMismatch",
        "storeManifestMismatch",
        "outputStoreManifestMismatch",
        "volumeRefMismatch",
        "volumeFenceMismatch",
        "volumeBuildMismatch",
        "bindingMismatch"
      ],
      "additionalProperties": false,
      "properties": {
        "unknownBuild": { "const": "Unknown" },
        "missingRegistryVolume": { "const": "Unknown" },
        "registryProfileMismatch": { "const": "Unknown" },
        "sameRevisionChangedHash": { "const": "Unknown" },
        "aliasCollision": { "const": "Unknown" },
        "runtimePathAbsent": { "const": "Unknown" },
        "unknownSourceKindOrDisposition": { "const": "Unknown" },
        "missingAcquisitionEnvelope": { "const": "Unknown" },
        "missingPhysicalVolume": { "const": "Unknown" },
        "missingReferenceVolume": { "const": "Unknown" },
        "unsupportedOutputVersion": { "const": "Unknown" },
        "unsupportedContractVersion": { "const": "Unknown" },
        "unsupportedStoreVersion": { "const": "Unknown" },
        "missingArtifactEvidence": { "const": "Unknown" },
        "volumeHashMismatch": { "const": "Unknown" },
        "volumeLengthMismatch": { "const": "Unknown" },
        "volumeContentMismatch": { "const": "Unknown" },
        "storeIntegrityFailure": { "const": "Unknown" },
        "storeSchemaMismatch": { "const": "Unknown" },
        "storeRowContentMismatch": { "const": "Unknown" },
        "storeManifestMismatch": { "const": "Unknown" },
        "outputStoreManifestMismatch": { "const": "Unknown" },
        "volumeRefMismatch": { "const": "Unknown" },
        "volumeFenceMismatch": { "const": "Unknown" },
        "volumeBuildMismatch": { "const": "Unknown" },
        "bindingMismatch": { "const": "Unknown" }
      }
    }
  }
}
