{
  "$schema": "../schema/aspx-platform-registry-profile.schema.json",
  "artifactVerification": {
    "acquisitionRunId": "Exact",
    "actualOutputBytes": "Required",
    "actualOutputLength": "Required",
    "jsonOutputVersion": "Exact",
    "jsonTypedContent": "ExactVersionedConformance",
    "outputStoreManifestBinding": "Required",
    "physicalStoreSchemaHash": "899aa84b3c1786e1e4754d23b943b4609d23dd4b19d34819c1b7e80ea1f4e504",
    "referenceStoreSchemaHash": "73eabd7a2001f7dbaaafa48db4f0c6489b57305a630b53aa2194d1c8cb9af5ec",
    "sqliteIntegrityCheck": "Required",
    "sqliteRunManifestHash": "Required",
    "sqliteSchemaManifestAlgorithm": "sqlite-schema-manifest/v2",
    "sqliteTypedRows": "ExactVersionedConformance"
  },
  "authorityArtifactHash": "8394ef9d5f1e6409131835ab123a5104afa5cedc17b65580831ebc7eee81e9d5",
  "authorityKind": "SPOCoreReleaseShippingManifest",
  "authoritySchemaVersion": "aspx-platform-authority/v1",
  "authoritySourceRef": "0ff1276087a43640144d8072fa347a886473855f",
  "authoritySourceTag": "release/16.0.27711.12757",
  "compatibilityDecisionRef": "CCD-411:approve_with_changes",
  "consumerCompatibilityHash": "7a38a2b1e643637d2e6a8e34d41e3784416238519bc99e526d74ac4b65435e7a",
  "consumerProductId": "pnp/assessment",
  "consumerProductRef": "pnp/assessment@3012555317d5a8ee981b9e103206f3f0680333d8",
  "consumerSourceRef": "3012555317d5a8ee981b9e103206f3f0680333d8",
  "contractReviewRef": "CCD-394#document-aspx-surface-applicability-denominator-v3@7d44f61d-919e-478a-ab8e-bb4c8f9b4b4a",
  "dispositions": [
    "ReferenceOnlyAvailable",
    "ReferenceUnavailable",
    "LinkedPhysicalGhosted",
    "LinkedPhysicalCustomized",
    "VirtualHandler",
    "NonAspx",
    "Unknown"
  ],
  "failureSemantics": {
    "aliasCollision": "Unknown",
    "bindingMismatch": "Unknown",
    "missingAcquisitionEnvelope": "Unknown",
    "missingArtifactEvidence": "Unknown",
    "missingPhysicalVolume": "Unknown",
    "missingReferenceVolume": "Unknown",
    "missingRegistryVolume": "Unknown",
    "outputStoreManifestMismatch": "Unknown",
    "registryProfileMismatch": "Unknown",
    "runtimePathAbsent": "Unknown",
    "sameRevisionChangedHash": "Unknown",
    "storeIntegrityFailure": "Unknown",
    "storeManifestMismatch": "Unknown",
    "storeRowContentMismatch": "Unknown",
    "storeSchemaMismatch": "Unknown",
    "unknownBuild": "Unknown",
    "unknownSourceKindOrDisposition": "Unknown",
    "unsupportedContractVersion": "Unknown",
    "unsupportedOutputVersion": "Unknown",
    "unsupportedStoreVersion": "Unknown",
    "volumeBuildMismatch": "Unknown",
    "volumeContentMismatch": "Unknown",
    "volumeFenceMismatch": "Unknown",
    "volumeHashMismatch": "Unknown",
    "volumeLengthMismatch": "Unknown",
    "volumeRefMismatch": "Unknown"
  },
  "platformBuild": "16.0.27711.12757",
  "platformFamily": "SharePointOnline-16",
  "profileHash": "c4a4892fa269484f0badd4fa24364161e8cd9cb0b8bdeac3eebd7b49fb51f51e",
  "profileRevision": "spo-online-16.0.27711.12757-profile-r1",
  "profileSchemaVersion": "aspx-platform-registry-profile/v2",
  "recordKind": "AspxReferenceObservation",
  "registryHash": "342b8ed81dfba8404ef70d7c3f876e950f641e861b0d0eab8f30b9cdbfdba5a2",
  "registryRevision": "spo-online-16.0.27711.12757-r1",
  "registrySchemaHash": "3ca69e123d826c4273c86b460a33f6d391455449c745e8b9b2455d7db0c9f4e9",
  "registrySchemaVersion": "aspx-platform-registry/v1",
  "sourceKinds": [
    "ListFormReference",
    "ListViewReference",
    "WebWelcomePageReference",
    "PlatformRegistryReference",
    "RuntimeRequestReference"
  ],
  "volumeCompatibility": {
    "aggregateOutput": "aspx-acquisition-verdict/v1",
    "physicalContract": "aspx-discovery/v2",
    "physicalOutput": "aspx-discovery-output/v2",
    "physicalStore": "aspx-discovery-sqlite/v2",
    "referenceContract": "aspx-reference/v1",
    "referenceOutput": "aspx-reference-output/v1",
    "referenceStore": "aspx-reference-sqlite/v1"
  }
}
